<?xml version="1.0" encoding="UTF-8"?>
<!DOCTYPE transcription [
   <!ENTITY % menotaEntities SYSTEM
      'http://www.menota.org/menota-entities.txt'>
   %menotaEntities;
]>
<transcription 
   xmlns:xsi="http://www.w3.org/2001/XMLSchema-instance"
   xsi:noNamespaceSchemaLocation="http://folk.uib.no/rpa021/emroon/v2-0-6/workbench/menotaBliX.xsd">
   <text>
      <div type="text">
         <div type="chapter">
            <head>
               :57v:
               :6:
               <num type="cardinal" value="5">.v.</num>
            </head>
            <p>
               :7: <c type="initial">S</c>væini æinu(m) saclausum var þungr gløpr kendr. (oc) galt h(ann)
               :8: í þvi annars ma(n)nz sem margtít er. (oc) r&aeligacute;nto þæir h(ann)
               tun-:9:gu (oc) male sinu.
            </p>
            <p>
               <c type="litNot">N</c>u hafðe h(ann) fregit (oc) spurt til miscu(n)nar
               :10: (oc) iartegna oláfs hins hælga k(onong)s. (oc) fystizc h(ann) þingat at fara
               :11: (oc) læíta sér miscunar við þa(n)n guðs ast_vín.
            </p>
            <p>
               <c type="litNot">H</c>æiman fór h(ann) (oc) co(m) þi(n)gat
               :12: til þes dyrlega staðar er h(ann) hvilir át. (oc) vacte þar iðulega (oc) bað bønu(m)
               :13: sinum. hét á h(ann) til hialpa. (oc) miscu(n)nar. bað í guðs nafne léa sér+mals
               :14: (oc) hæilsu er h(ann) hafðe mist fyrir+utan sin tilv&eogon;rca.
            </p>
            <p>
               <c type="litNot">N</c>u á stund nocorre
               :15: um dag æin þa sofnaðe h(ann) í kirkiu ínni. (oc) syndisc h&aolig;nu(m) i søfne (maðr)
               :16: ein æinca_friðr (oc) æigi al+hór at vexti ganga til sín ut ór scrinino. (oc)
               :17: toc hendi sinni í mun h&aolig;nu(m) (oc) hæimti til sin þa(n)n litla stuf er eptir
               :18: stoð tungu(n)nar. (oc) togaðe sva hart (oc) tøygði at sá+ungi (maðr) fec æigi þolat
               :19: í søfneno(m) u_øpande.
            </p>
            <p>
               <c type="litNot">Ð</c>vi næst vacnaðe h(ann) (oc) ræis upp hæil (oc) þaccaðe
               v&aolig;-:20:rum drotne fegin_samlega (oc) þæim guðs vín er h(ann) hafðe hæilsu (oc)
               mis-:21:cun af þeget. faret þangat aðr mallaus (oc) sot h(an)s hælga scrin. (oc) for
               :22: þaðan hæil (oc) scoren_orðr til síns hæimilis.
            </p>
         </div>
      </div>
   </text>
</transcription>